	query	product_text	relevance_label	id
322778	rolling pin without handle	Hand-held Embossed Rolling Pins Christmas Wooden Hand Grip Engraved Rolling Pin for Baking Non-stick Embossed Professional Dough Roller for Cookies with Patterns for Kids and Adults (Snowflake)  3D Wooden Christmas Embossed Pattern Rolling Pin Specification: Item type: Rolling pin Color: As show Material: Wood Size: 14 * 5 * 3cm Weight: 0.26 kg Type:1#(Snowflake), 2#(Elk), 3#(Christmas tree), 4#(Christmas pattern)  Durable & Safe Material Christmas embossed rolling pins are made of wood, no wax, no paint, non-stick, more durable, no burrs. It will not be white after soaking in the water, no cracks under sunshine, not mold even in the damp places. Multi-function Perfect rolling pins with patterns for cookies, pasta, biscuit dough, pastries, bread, pizza, waffles, fondant, pancakes, clay, etc. Having fun with all your family Our textured rolling pin is very easy to use and can be a really nice housewarming and pretty gift for your friends, kids and your kitchen. So have some fun using this engraved rolling pin with your whole family.   	1	353782
1365118	led light bulbs 60 watt soft white	GE Relax 2-Pack 75 W Equivalent Dimmable Warm White A21 LED Light Fixture Light Bulbs 46322  GE Relax HD Soft White LED 75-Watt Replacement A21 light bulbs provide enhanced color contrast and boldness versus standard LED bulbs. The high definition soft white light helps create a comfortable, cozy light that’s ideal for bedroom lighting, foyer lighting, family rooms and dining rooms. They’re dimmable and illuminate your home with soft white light. These are great for frequently used fixtures—GE Relax HD Soft White LED bulbs are rated to last twice as long as GE Basic LED bulbs and save 102 dollars on energy costs over the bulb's life versus a 75-Watt incandescent bulb. Unlike CFL bulbs, GE LED HD bulbs feature enhanced color, instant full brightness and are free of Mercury. Replace CFL and incandescent light bulbs with GE Relax HD Soft White LED general purpose light bulbs in indoor table lamps, sconces and open fixtures, including damp locations.  GE Relax HD Soft White LED 75-Watt Replacement A21 light bulbs provide enhanced color contrast and boldness versus standard LED bulbs. The high definition soft white light helps create a comfortable, cozy light that’s ideal for bedroom lighting, foyer lighting, family rooms and dining rooms. They’re dimmable and illuminate your home with soft white light. These are great for frequently used fixtures—GE Relax HD Soft White LED bulbs are rated to last twice as long as GE Basic LED bulbs and save 102 dollars on energy costs over the bulb's life versus a 75-Watt incandescent bulb. Unlike CFL bulbs, GE LED HD bulbs feature enhanced color, instant full brightness and are free of Mercury. Replace CFL and incandescent light bulbs with GE Relax HD Soft White LED general purpose light bulbs in indoor table lamps, sconces and open fixtures, including damp locations.	1	1040484
110684	battery powered snow blower	Greenworks 40V 150 MPH Variable Speed Cordless Blower, Battery Not Included 24282 (Renewed)  This pre-owned or refurbished product has been professionally inspected and tested to work and look like new. How a product becomes part of Amazon Renewed, your destination for pre-owned, refurbished products: A customer buys a new product and returns it or trades it in for a newer or different model. That product is inspected and tested to work and look like new by Amazon-qualified suppliers. Then, the product is sold as an Amazon Renewed product on Amazon. If not satisfied with the purchase, renewed products are eligible for replacement or refund under the Amazon Renewed Guarantee.  This pre-owned or refurbished product has been professionally inspected and tested to work and look like new. How a product becomes part of Amazon Renewed, your destination for pre-owned, refurbished products: A customer buys a new product and returns it or trades it in for a newer or different model. That product is inspected and tested to work and look like new by Amazon-qualified suppliers. Then, the product is sold as an Amazon Renewed product on Amazon. If not satisfied with the purchase, renewed products are eligible for replacement or refund under the Amazon Renewed Guarantee.	1	1472604
1314239	mini fridge without freezer glass door	Frigidaire Retro Bar Fridge Refrigerator with Side Bottle Opener, 3.2 cu. ft, Red  Welcome to the world of quality built, affordable kitchen products. Introducing the beautiful retro 3.2 CU. FT compact refrigerator! This refrigerator is at the next level! The fridge is happy hour ready with an attached bottle opener, chrome pull handle and removable glass shelves which makes it perfect for an easy clean up. The interior freezer compartment will keep any leftovers nice and fresh, a gallon door bin with adjustable temperature control so you can keep your white wine nice and chilly, and if you’re not a wine person, have no fear, there’s a dispense-a-can for all your soda and beer needs. All this for an affordable price  Welcome to the world of quality built, affordable kitchen products. Introducing the beautiful retro 3.2 CU. FT compact refrigerator! This refrigerator is at the next level! The fridge is happy hour ready with an attached bottle opener, chrome pull handle and removable glass shelves which makes it perfect for an easy clean up. The interior freezer compartment will keep any leftovers nice and fresh, a gallon door bin with adjustable temperature control so you can keep your white wine nice and chilly, and if you’re not a wine person, have no fear, there’s a dispense-a-can for all your soda and beer needs. All this for an affordable priceFrom the manufacturer Frigidaire Retro Bar Fridge Refrigerator with Side Bottle Opener, 3.2 cu. ft, Red 3.2 Cubic Foot Capacity (90 Liters) Cabinet Mounted Bottle Opener Dependable Compressor Cooling 2L Bottle Storage In Door Ice Cube Tray Interior Freezer/Ice Chamber Adjustable Thermostat Space Saving Flush Back Design CFC Free 	1	1585019
1107478	silicone cake pan xl rectangle	"CAKETIME Muffin Pan Silicone Brownie Molds - Cupcake Pan Baking Silicone Molds Food Grade Silicone BPA Free Brioche Pan Pinch Test Approved  3 in 1 Value Set - Regular 12 Cups+ Mini 24 Cups + 12 Rectanglar Brownie You just make a pinch, if it turns white, it is not LFGB, these silicone muffin pans never turns white Use these baking molds to make more healthy and delicous treats for your kids and family What you can get: 1pc * Round 12-cup baking mold: 9.6""x 12.8""; Each cavity: Dia: 2.7"" x H:1.2"" 1pc * Mini 24-cup baking mold: 9.4""x13.4""; Each cavity: Dia: 1.8"" x H: 0.7"" 1pc * Rectangular 12-cup brownie mold: 9.9""x*10.1""; Each cavity: W: 1.9"" x L: 2.9"" x H; 1""  Non-stick surface & Easy to release WIDE HEAT RESISTANT: -104℉ to 446℉; tasteless, safe for oven, microwave, dishwasher, fridge, freezer. Multi function Making Muffin Cakes, Tart, Bread, Mousse, Jelly, Conditioning Food, Brownie Cupcakes, Custard, Soap, Mini loaf. Enjoy your DIY treats with Fun Baking 48 treats at a time with our premium silicone baking molds.  24-cup & 12-cup 12-cup Baking Pan 24-cup Baking Pan 5 Animal Candy Molds Bear Candy Molds Pinch Test Approved ✓ ✓ ✓ ✓ ✓ BPA Free ✓ ✓ ✓ ✓ ✓ Dishwasher Safe ✓ ✓ ✓ ✓ ✓ Food Grade Silicone ✓ ✓ ✓ ✓ ✓ "	1	1093342
809315	baruto action figures	LEGO DC Batman: Batman and The Joker Escape 76138 Building Kit (171 Pieces)  Young children will love role-playing as Batman to stop a Super-Villain prison breakout with this LEGO DC Batman 76138 Batman and The Joker Escape super-hero toy playset. Specially designed to be fun and easy for preschoolers, this LEGO 4+ set includes Batman’s helicopter with a special Starter Brick chassis that lets even first-time builders experience the pride of building all on their own. A great birthday gift, this action-packed kids’ toy playset also features an Arkham Asylum model with lots of details to inspire play including 2 jail cells with walls that can be pulled down by attaching a chain and hook from Harley Quinn’s bike. It comes with 4 LEGO minifigures with weapons and a simple guide to build and play to help young super heroes understand the purpose of the building steps and grow their imagination and confidence for the perfect start to LEGO brick building. Instructions PLUS are also available for this Batman toy playset in the LEGO Life app for smartphones and tablets. These easy-to-use, intuitive building instructions let kids zoom, rotate and visualize their creation using the special ghost mode as they go.  Young children will love role-playing as Batman to stop a Super-Villain prison breakout with this LEGO DC Batman 76138 Batman and The Joker Escape super-hero toy playset. Specially designed to be fun and easy for preschoolers, this LEGO 4+ set includes Batman’s helicopter with a special Starter Brick chassis that lets even first-time builders experience the pride of building all on their own. A great birthday gift, this action-packed kids’ toy playset also features an Arkham Asylum model with lots of details to inspire play including 2 jail cells with walls that can be pulled down by attaching a chain and hook from Harley Quinn’s bike. It comes with 4 LEGO minifigures with weapons and a simple guide to build and play to help young super heroes understand the purpose of the building steps and grow their imagination and confidence for the perfect start to LEGO brick building. Instructions PLUS are also available for this Batman toy playset in the LEGO Life app for smartphones and tablets. These easy-to-use, intuitive building instructions let kids zoom, rotate and visualize their creation using the special ghost mode as they go.From the manufacturer Batman toy playset for kids aged 4 and over Give young kids a fun introduction to Batman adventures with easy-to-build Arkham Asylum, Batcopter and bike models. Build, learn and role-play Even novice LEGO builders can build on their own using the simple guide and then create their own super-hero stories.  LEGO DC Batman: Batman and The Joker Escape Harley Quinn’s bike Prison cell walls can be pulled down with the bike’s chain and hook. Arkham Asylum security Kids can pretend to be a prison guard in the watchtower. 2 prison wings There is a cell in each prison wing to hold the Super-Villains.  Super-Villain possessions Set includes The Penguin's hat and other items to inspire play. Batman’s Batcopter The Starter Brick chassis makes it easy to build. Mobile catapult Features 2 bomb launchers for action-packed battles.  Includes 4 LEGO minifigures Batman with a Batarang and megaphone element, Harley Quinn with a baseball bat, The Joker and a prison guard.  	1	60573
45296	allison kids hair detangler	Hair Detangler Spray for Kids. Made with Organic Aloe Vera Juice and Natural Vitamins to Hydrate. Organic Detangler and Leave In Conditioner for Children & Adults. No Chemicals or Fragrance. USA Made.  Perfect for the Entire Family! Little Roseberry Hair Detangler Spray for Kids , is Made with all the Goodness of Organic Aloe Vera Juice, Rosemary and Natural Vitamins to Enhance the Hair’s Natural Glow and Well-being . Our 2 in 1 Formula can be Used on Kids all Ages! Even Mommy, Daddy and Granny can take Advantage of our Leave-in Hair Detangler and Enjoy the Moisturizing Benefits.  TWO IN ONE: Hair Detangler + Leave in Conditioner Formula Perfect to Enhance Curls and to Make Brushing a Lot Easier! . WEIGHTLESS: Works Great on Fine, Coarse, Straight, Curly or Extremely Elastic Hair ... Without Making the Hair Flat or Lifeless. ORGANIC INGREDIENTS : Rich in Antioxidants , Vitamins such as Folic Acid and Minerals such as Calcium to Repair Dry and Damaged Hair. SAFE ON SENSITIVE SKIN: Safe to Use if you Suffer from Eczema, Cradle Cap, or Sensitive Scalp.  HYDRATING & MOISTURIZING: Our Hair Detangler Spray For Kids Leaves the Hair Soft, Shiny, Less Frizzy and Conditioned. BABY SAFE: Our Baby Hair Detangler Spray is a must have to Untangle your Little One's Delicate Hair. Say NO to the Bedhead Look!. CHEMICAL FREE: Made with All Natural Ingredients! . 100% Toxin-free. No fragrance. No Parabens or Sulfates.     	1	76703
21966	"rug 3.3 x 47"""	nuLOOM Becca Vintage Tile Area Rug, 3' x 5', Beige  Create a home filled with warmth with our traditional tile area rug. With neutral color hues and a unique tile like pattern, this rug will pair seamlessly with any of your existing décor. Machine made from soft and durable fibers, this floor covering is perfect for high traffic areas of your home. Relax and unwind with our pet-friendly and easy to care for area rugs.  Create a home filled with warmth with our traditional tile area rug. With neutral color hues and a unique tile like pattern, this rug will pair seamlessly with any of your existing décor. Machine made from soft and durable fibers, this floor covering is perfect for high traffic areas of your home. Relax and unwind with our pet-friendly and easy to care for area rugs.From the manufacturer  Versatile & Beautiful Blending centuries old motifs with modern elements, vintage rugs are an easy way to incorporate the look of heirloom pieces into your décor scheme Built to Last Power-loomed construction ensures this rug will look great even in high traffic areas (such as hallways and living rooms) Kid & Pet Friendly Our high quality synthetic materials are carefully selected to ensure resistance to common spills and stains Unique Colorways This rug is bound to make a statement. Choose from 4 unique colorways to find the perfect style for your home  nuLOOM Non-Slip Grip Rug Pad nuLOOM Ultra Premium Non-Slip Rug Pad nuLOOM Comfort Grip Rug Pad Features Standard Premium Standard Material PVC 100% Recycled Synthetic Fibers PVC Thickness 0.15 Inch 0.25 Inch 0.2 Inch Cut to Size ✓ ✓ ✓ Find the perfect rug size for your room For smaller areas we recommend a 5’ x 8’ or 6’ x 9’ rug. If you are placing the rug under a coffee table, make sure that it can accommodate all four legs of the table Larger rooms typically require a rug that is between 6’ x 9’ and 8’ x 10’. Place the front legs of your sofa on top of the rug or have all four legs rest on the rug To have furniture framed in the center of a large room, we recommend a 9’ x 12’ or larger rug. An equal amount of floor space (between 12” - 18”) should be left on all sides if possible  About nuLOOM At nuLOOM we believe home decor is a form of self-expression. Over the past 20 years we have built our company by filling the void between brilliant design and affordability. We create unique designs and source our items from artisan manufacturers all over the world.  	1	1154829
28451	electrolyte tablets chewable	C2O The Original Coconut Water w/ Nutrients & Electrolytes, Rejuvenating Plant-Based Hydration, the Original, 16.3oz cans (8-Pack)  Green Coconut Difference: C2O uses young green coconuts that are extra fragrant, tasty and unique to the inland soils of Thailand; They have a sweeter, freshwater taste that is more appealing than the salty, coastal flavor of other brands  Green Coconut Difference: C2O uses young green coconuts that are extra fragrant, tasty and unique to the inland soils of Thailand; They have a sweeter, freshwater taste that is more appealing than the salty, coastal flavor of other brandsFrom the manufacturer C2O Coconut Water was founded over a decade ago and has become one of the top coconut water brands in the United States. We trace our roots back to Thailand where founder Ron Greene discovered a particular varietal of coconut water that was naturally aromatic & sweet in flavor. C2O is loved by a wide range of athletes, natural foodies, healthy moms and millennials craving a way to hydrate naturally. We invite you to 'Live Rejuvenated'. C2O Coconut Water Conquer Thirst Naturally C2O Coconut Water is an excellent way to conquer thirst naturally. Packed with electrolytes and great taste, our coconut water is perfect for hydrating and restoring balance to your daily routine. Never From Concentrate 5 Essential Electrolytes No Artificial Colors, Flavors, or Preservatives Non-GMO Project Verified (NonGMOproject.org Certificate number 43356, renewal date 2/26/2019) Sustainable Sourcing Methods Fat-free and Cholesterol-free (verified by nutritional panel) Ingredients include: 100% coconut water, young coconut pulp For flavored coconut waters, ingredients include: coffee extract, 100% juices, Ginger, Tumeric  What makes C2O Coconut Water great? Sustainably Sourced C2O Coconut Water uses sustainable sourcing methods that are good for the environment and the communities in which we serve. C2O Coconut Water is sourced from freshwater coconut groves that produce fragrant young green coconuts with exceptional flavor and taste. C2O and our Co-Op of farmers are dedicated to producing the finest coconuts in the world. We care about sustainability and are focused on developing thriving communities that support our farmers and their families. Exceptional Quality You Can Taste C2O sources a fresh water varietal of coconut that yields a more delightful taste than the salty flavor that accompanies more commonly used coastal coconuts. We produce products that taste amazing and do not contain any artificial colors, flavors, or preservatives. Our flavors are created using real fruit juice and purees to deliver maximum refreshment. C2O For Any Occasion Packed with electrolytes and great taste, C2O is perfect for: Anytime Hydration On-the-go Refreshment Post-workout Recovery Smoothies & Smoothie Bowls Mealtime Moments Recipe 'Smart Swaps' Natural Mixer  Pure Coconut Water 10.5 Pure Coconut Water 16.3 Ginger Lime & Turmeric Espresso Coconut Water Pure Coconut Water 1 Liter Size 10.5 oz (330ml) 16.3 oz (485ml) 17.5oz (520ml) 17.5oz (520ml) 33.8 oz (1 Liter) Activity Group Events, BBQ's, Office Parties, Kids Activities, Sporting Events Anytime Hydration, Fitness, On-The-Go Activity Anytime Refreshment, Mealtime Refreshment, Smoothies & Bowls, Recipes, Mixers Anytime Energy, Anytime Energy, Morning Pick-Me-Up, Studying, Driving, Sports, Work, Pre-Workout Family Size, All-Day Hydration, Smoothies, Recipes, Camping, Travel Supports Hydration ✓ ✓ ✓ ✓ ✓ Never From Concentrate ✓ ✓ ✓ ✓ ✓ Non-GMO ✓ ✓ ✓ ✓ ✓ No Added Sugar ✓ ✓ ✓ Coconut Sugar ✓ Contains Caffeine - - - 199 mg - Flavors Available Pure Coconut Water, Pure Coconut Water w/ Pulp Pure Coconut Water, Pure Coconut Water w/ Pulp Ginger Lime Turmeric, Pineapple, Mango Espresso Pure, Pineapple 	1	549699
398254	mens mummy shirt	Disney Donald Duck Mummy Halloween Costume T-Shirt  Suit up in mummified fashion when you don this striking Disney t-shirt. Featuring stylized artwork of Donald Duck dressed up as a mummy for trick-or-treating adventures, this epic tee shirt will infuse your look with frightful flair! This Disney design is available on a t-shirt, tank top, long sleeve tee, and sweatshirt!  Suit up in mummified fashion when you don this striking Disney t-shirt. Featuring stylized artwork of Donald Duck dressed up as a mummy for trick-or-treating adventures, this epic tee shirt will infuse your look with frightful flair! This Disney design is available on a t-shirt, tank top, long sleeve tee, and sweatshirt!From the brand Previous page T-Shirt Best Sellers Visit the Store Retro and Vintage T-Shirts Visit the Store Mickey and Friends Visit the Store Seasonal T-Shirts Visit the Store Celebrate Your Birthday Visit the Store Shop More Disney Items Visit the Store Next page From the manufacturer 	1	514808
348345	skipdrill	Digital Innovations 1051100 Replacement Accessories Kit  SkipDr Replacement Accessories Kit is designed to work with Classic, Deluxe and Premier versions of the SkipDr, GameDr and DvdDr Disc Repair Systems.  SkipDr Replacement Accessories Kit is designed to work with Classic, Deluxe and Premier versions of the SkipDr, GameDr and DvdDr Disc Repair Systems.	1	214618
628916	# 2 pencils not sharpened	"ezpencils - Sea Blue Barrel Golf (1/2 a pencil - Pew pencils) Hexagon Pencils without Eraser - 48 pkg - No Eraser - # 2 HB Lead - Sharpened - Non-Branded - NEW  48 High quality woodcased HB No. 2 Lead - Sea Blue barrel -Pew Pencils - 1/2 a pencil - Games pencils - Hexagon graphite pencils – No eraser. - 3.25"" Overall Length - Sharpened - Use for office supply, School supply, Students, Teachers, Record keeping, Family reunions, Churches, ETC.  48 High quality woodcased HB No. 2 Lead - Sea Blue barrel -Pew Pencils - 1/2 a pencil - Games pencils - Hexagon graphite pencils – No eraser. - 3.25"" Overall Length - Sharpened - Use for office supply, School supply, Students, Teachers, Record keeping, Family reunions, Churches, ETC."	1	1655730
752049	optcon ancrestral	Family Care Refreshing Lubricant Eye Drop Preservative Free Single Use Vials Individually Sealed containers of 5 vials, Relief for Redness Dry itching Sensitive Allergies 1 Package (100 Count)…  About Us Family Care offers high quality over-the-counter health products at affordable prices. Designed with families in mind, to provide a diverse range of products to enhance health and well-being. Eye Care Ear Care Nasal Care Topicals 100 Count Single Use Vials of Lubricating Eye Drops Tears are important to our health and wellness Not much is more important than the wellness and health of our eyes. The under appreciated workhorse of our bodies, our eyes are constantly moving and reading our surroundings. A multitude of things can happen to cause the eyes to become irritated and red. At the first sign of discomfort, apply a couple eye drops to protect and nourish. Preservative-Free Moisturizes Lubricates Protects Sterile Long lasting relief and comfort Singular active ingredient Small enough for your bag or pocket  Causes of Eye Discomfort Dry Eyes There are times when our tears cannot properly moisturize our eyes. This can result in dry, red irritated eyes. Computer Use The eyes are constantly moving back and forth as you read on the computer screen. Along with having to focus and refocus, causing eyes strain. Allergens The body's natural defense system to allergens is to release histamines which cause itching, redness, and watery eyes. Contacts Long-term use of contact lenses can be a factor in the development of dry eyes.  Easy to Use Vials Twist off top Instill 1 or 2 drops in the affected eye(s) Soothing moisture  	1	387590
923659	otterbox iphone xs	iPhone Xs Max Case,Anime Cartoons 337 Pattern Design iPhone Xs Max Cases, Tempered Glass Back + Soft Silicone TPU Shock Absorption Bumper Protective Case Compatible for iPhone Xs Max  Why choose this Phone case? This iPhone Xs Max Case keeps the original glass texture of iPhone Xs Max itself, to satisfy your trendy and luxury taste while allaying any worries about phone safety. Each piece of glass experiences 4 hours strong toughening to receive real scratch-resistant, anti-fingerprint, drop-resistant and shockproof properties. Exclusive adorable pattern makes your cellphone case more fashionable. About Product Fully compatible with all kinds of wireless charging and will not block any signal. Cutout design for Speaker, Screen, camera and ports, easy access to all ports and connectors. Made of Tempered Glass Back Soft TPU Frame to offer superior quality and full body protect your phone. It is easy to hold,the anti-slip properties provide excellent grip made it difficult to slide in and out of pocket. Featuring the innovative new shock technology, prevents your iPhone from being harmed of dropping, scratching and collision. Our Service If you meet any question, please contact with us, we will fix your issue within 24 hours. Package Includes 1 x Phone Case for iPhone Xs Max  Why choose this Phone case? This iPhone Xs Max Case keeps the original glass texture of iPhone Xs Max itself, to satisfy your trendy and luxury taste while allaying any worries about phone safety. Each piece of glass experiences 4 hours strong toughening to receive real scratch-resistant, anti-fingerprint, drop-resistant and shockproof properties. Exclusive adorable pattern makes your cellphone case more fashionable. About Product Fully compatible with all kinds of wireless charging and will not block any signal. Cutout design for Speaker, Screen, camera and ports, easy access to all ports and connectors. Made of Tempered Glass Back Soft TPU Frame to offer superior quality and full body protect your phone. It is easy to hold,the anti-slip properties provide excellent grip made it difficult to slide in and out of pocket. Featuring the innovative new shock technology, prevents your iPhone from being harmed of dropping, scratching and collision. Our Service If you meet any question, please contact with us, we will fix your issue within 24 hours. Package Includes 1 x Phone Case for iPhone Xs Max	1	1034843
