	query	product_text	relevance_label	id
1049061	mens xxl compression socks	Amazon Brand - Solimo Open Toe Compression Socks for Men & Women, Knee High, Sheer, Beige, 15-20mmHg, X-Large, 1 Pair  Solimo Knee High Open Toe Compression Socks are made with a tight weave which is snug but flexible and with a reinforced heel for added comfort and durability. Perfect for prolonged sitting or standing, airplane travel, post pregnancy or surgery recovery or working out.  Solimo Knee High Open Toe Compression Socks are made with a tight weave which is snug but flexible and with a reinforced heel for added comfort and durability. Perfect for prolonged sitting or standing, airplane travel, post pregnancy or surgery recovery or working out.From the manufacturer  Swollen Legs Tired, Aching Legs Airplane Travel Working Out Muscle Recovery Leg Swelling During Pregnancy Prolonged Sitting or Standing Creates Appearance of Smoother Legs Solimo Compression Socks - Open Toe, Beige Our Compression Socks provide moderate pressure in a comfortable range that is ideal for everyday wear. The socks allow for a full range of motion and joint flexibility to provide support for a range of minor conditions. Solimo Compression Socks stimulate oxygen delivery to muscles and can help reduce swelling and aching legs, ankles, and feet due to long periods of sitting or standing.  Product Features: Knit Tight weave is flexible but snug and can stretch in all directions Seam Thin seam between the wide control top and the main construction of the sock improves comfort Reinforced Heel For added comfort and durability  Open Toe Beige Closed Toe Beige Closed Toe Black Style Open Toe Closed Toe Closed Toe Color Beige Beige Black Compression 15-20 mmHg 15-20 mmHg 15-20 mmHg Unisex ✓ ✓ ✓  	1	1238761
1066108	16x24 above ground winter pool cover	Blue Wave BWC926 Gold 15-Year 16-ft x 28-ft Oval Above Ground Pool Winter Cover,Royal Blue  The Dirt Defender Gold grade cover is constructed of our strongest and most tear resistant material. This cover features rugged U.V. stabilized woven polyethylene that protects it from sun, snow, wind and ice. It features a black underside to retard algae growth and heat sealed seams to ensure a crystal clear pool next spring. The cover features a big 4 foot overlap that means it will fit above ground pools with wider top rails unlike smaller 3 foot overlap covers. This Dirt Defender Gold grade cover is held secure by a heavy duty cable and winch tightener that is anchored to the cover by rip proof metal grommets. This rugged cover is built to last, backed by a 15 year warranty (3 years full rated). Invest in quality this fall with Dirt Defender Gold. This Dirt Defender cover comes in royal blue with a black underside.  The Dirt Defender Gold grade cover is constructed of our strongest and most tear resistant material. This cover features rugged U.V. stabilized woven polyethylene that protects it from sun, snow, wind and ice. It features a black underside to retard algae growth and heat sealed seams to ensure a crystal clear pool next spring. The cover features a big 4 foot overlap that means it will fit above ground pools with wider top rails unlike smaller 3 foot overlap covers. This Dirt Defender Gold grade cover is held secure by a heavy duty cable and winch tightener that is anchored to the cover by rip proof metal grommets. This rugged cover is built to last, backed by a 15 year warranty (3 years full rated). Invest in quality this fall with Dirt Defender Gold. This Dirt Defender cover comes in royal blue with a black underside.From the manufacturer  Blue Wave BWC926 Gold 15-Year 16-ft x 28-ft Oval Above Ground Pool Winter Cover, Royal Blue The Blue Wave Gold grade cover is constructed of our strongest and most tear resistant material. This cover features rugged U.V. stabilized woven polyethylene that protects it from sun, snow, wind and ice. It features a black underside to retard algae growth and heat sealed seams to ensure a crystal clear pool next spring. The cover features a big 4 foot overlap that means it will fit pools with wider top rails and will not stretch and rip like smaller 3 foot overlap covers. Our Gold grade cover is held secure by a heavy duty vinyl coated cable and tightener that is anchored to the cover by rip proof metal grommets spaced 30 inches apart. Invest in quality this fall with Blue Wave Gold. This Blue Wave cover comes in Royal Blue with a black underside.  Additional Information Pool & Cover Size Pool size: 16-feet x 28-feet oval Cover size: 20-feet x 32-feet oval Rugged U.V. stabilized woven polyethylene This cover features rugged U.V. stabilized woven polyethylene that protects it from sun, snow, wind and ice. It features a black underside to retard algae growth and heat sealed seams to ensure a crystal clear pool next spring. Cable & Winch Included Our Gold grade cover is held secure by a heavy duty vinyl coated cable and tightener that is anchored to the cover by rip proof metal grommets spaced 30 inches apart.  	1	1147621
893194	picture frames horizontal multi photo	MRQ 15.6 inch Digital Photo Frame, 1280x800 HD Picture Video(1080P) Frame with Auto-Rotate, Motion Sensor, E-Book, Calendar, Alarm, Supports Multiple File Formats and External USB and SD Card-Black  This stylish modern digital photo frame looks good wherever you place it and is sure to draw the eyes of family and friends. Exceptionally bright and detailed IPS screen displays your photos with remarkable image quality and vibrant colors. The new version MRQ 15.6 Inch digital photo frame renders high performance for its superior design, material selection, and technology. Package Contents: 1 x 15.6 Inch Digital photo frame 1 x Stand Bracket 1 x Remote control 1 x Wall adapter 1 x User Manual 1 x Wall Mountable Accessories Perfect Home Decoration Product with Updated Gift Package! With the gift package, your family will be very happy to receive the product! What shows on the package: I love you not because of who you are, but who I am when I am with you. Please noted that the gift package is version 2.0. Wonderful frame to show all your photos MRQ 15.6 Inch Digital Photo Frame-Presence of Your Beloved Read before purchase: 1. This is not wifi digital photo frame, so it can't connect with a phone; 2. You need to plug the wall charger when you use the product; 3. Without internal storage, only support SD MMC or USB flash drive to plug and play. Why we don't put the internal storage? internal storage will lower the speed when you display photos, it will conflict with outside service Notice about Auto-rotate function: Please understand that there are some black borders if you choose this function, just like even if you see the photos on your computer, it is the same situation. When you choose full-screen display mode, this kind of photos will be enlarged without shape viewing It is not the problem of the frame if your photos won't auto rotated, please send the files to customer center service to check the issue of the file. Not all format support auto-rotated function. What functions do I have? Take me home! ! ! Multiple Formats Supported It is like a breeze right out of the box to get started using this digital photo frame by simply mounting the bracket and plugging in the adapter and your SD card and USB up to 32G. Better to use 2.0 USB for better compatibility. Auto Rotation Function -15.6 inch 1280*800 HD IPS screen redefines your viewing experience with all the innocent smiles of your children, your good time with family, or any of the wonderful moments all presented vividly! -16:10 aspect ratio makes it perfect to display all your valued photos or videos in a perfect ratio. It also supports 1920 x 1080 Full HD resolution video playing on its unbelievable whopping screen. Motion Sensor The equipped energy-saving motion sensor helps sense light and motion, so the screen will go on or off automatically when you enter or leave the room without consuming too much power. The trigger distance to a maximum of 2.5 meters. You can manually set it in the settings of this digital photo frame with an interval of 30sec/ 1min/ 3min/ 4min/ 5min/ off  Wonderful frame to show all your photos Clock Functions and Display Photos with Background Music The MRQ Digital Photo Frame is equipped with 15.6 inches 1280*800 HD Screen and is as slim as only 1 cm. It's designed and manufactured by our professional team, qualified with the advanced manufacturing process, and the raw material promises top quality and superior product performance. This digital frame is a perfect gift for anyone for its easy setup, even though you might not be tech-savvy. Remote Control and Easy to Set Up A handy remote control is included in the package to make it easy for you to get a thorough control of our MRQ digital photo frame. Please remove the plastic insulation paper before using this remote. Large Screen Size with Better Viewing Experience USB, SD and MMC Card (up to 32G) Image Format: JPEG, BMP, GIF, PNG Audio Format: MP3, P2, MP1, WMA, OGG, APE, FLAC, AC3, RA, AAC Video Format: RM, RMVB, MKV, MOV, M4v, MPG, FLV, PMP, AVI, VOB, DAT, MP4, 3GP E-Book: TXT  Compare with traditional photos, the digital photo frame can display all your family photos in one frame with background music, much more fashion! A Perfect Gift for Your Beloved Ones Apart from the basic features, this digital photo frame also supports background music while playing photos, calendars, ebooks, auto power on and off function which all contribute to its versatility. This digital frame is a perfect gift for anyone who wants to keep and enjoy their valued memories-from friends to parents and grandparents, even though who might not be tech-savvy.   	1	1208379
683331	black leather thong panties men	"TiaoBug Men's Lingerie Satin Sissy Pouch Triangle Briefs Thong Underwear Panties  Set Include: 1Pc Men's Underwear Condition: New with tag Material: Polyester + Spandex Tag No.---|---Adult Recommended Size---|----------Waist------- ---M------|-----------Medium-----------|---27.5-42.0""/70-106cm ---L------|------------Large-----------|---29.0-43.0""/74-110cm ---XL-----|-----------X-Large----------|---31.5-46.0""/80-116cm  Set Include: 1Pc Men's Underwear Condition: New with tag Material: Polyester + Spandex Tag No.---|---Adult Recommended Size---|----------Waist------- ---M------|-----------Medium-----------|---27.5-42.0""/70-106cm ---L------|------------Large-----------|---29.0-43.0""/74-110cm ---XL-----|-----------X-Large----------|---31.5-46.0""/80-116cm"	1	992215
1414892	trowel machine	"Bon Tool 12-147 Handle - Swaged 1 3/8"" X 6'  Over more than six decades, Bon has grown to be a global leader in the manufacture of professional construction tools for the trowel trades. With a firm commitment to provide the best value and to maintain the highest standards of workmanship and customer care, Bon remains a trusted source in the industry.  Over more than six decades, Bon has grown to be a global leader in the manufacture of professional construction tools for the trowel trades. With a firm commitment to provide the best value and to maintain the highest standards of workmanship and customer care, Bon remains a trusted source in the industry.From the manufacturer ABOUT BON The recognizable Bon brand encompasses our full product line of premier, contractor-grade tools. Bon has one of the largest selection of tools for the trowel trades in the marketplace. We put our trusted name behind every product we offer.  "	1	1542271
648228	led headlights kit civic 05	BEAMTECH H4 LED Bulbs, 16000LM 70W 6500K Extremely Super Bright 9003 30mm Heatsink Base CSP Chips Conversion Kit,Xenon White Small Size Halogen Replacement From the brand Previous page Over the past ten years, BEAMTECH have been striving with vigorous passion since our establishment in 2010! In the past, we established our brand based on integrating led bulbs with technology: BEAMTECH Now, we have developed various car led bulbs. We devote ourselves to win customers with distinguished and safe products. In the future, we will continue to manufacture high-performance led bulbs. We are welcome you to witness our growth! MINI LED BULB:16000LM/70W Visit the Store V4 LED BULB:12000LM/60W Visit the Store F6 LED BULB:22000LM/120W Visit the Store 10G LED FOG LIGHT:6500K WHITE Visit the Store HID BULB:6000K/8000K/10000K Visit the Store Why after installing the bulb, there have the flicker/error/interference? Some car's system is sensitive to the led bulb, we can send the decoder/resistor to help you solve the problem. Why the dust cover can't install back after installing the bulb? The bulb design with the fan and the drive for better heat dissipation, we can send the suitable dust cover for you to replace. The bulb is failure, where can i get a new bulb? We would help you solve the problem, we can resend a new bulb to you for replacement. Next page  BEAMTECH H4 LED Bulb,Getting The Sunshine At Dark Night. Light type:H4 (9003) Input Power: 70W/SET Luminous Flux:16000LM/SET Light Source Model:CSP Light Source Technology Placement on Vehicle: Left,Right,Front Voltage: DC9-32V IP Rate: IP65 LED Color: Bright White Color Temperature: 6500K Heat Dissipation: Aviation Aluminum 6063 Life-Span: 30000Hrs+ Operating temperature: -40C to +80C Installation: Plug and Play. True Plug-N-Play * These bulbs are CanBUS-Ready and will work with most vehicle's computer system without error. H11 9005 9006 H7 880 H13 LED CSP CSP CSP CSP CSP CSP Color Temp 6500K 6500K 6500K 6500K 6500K 6500K Heat Sink Fan-based Fan-based Fan-based Fan-based Fan-based Fan-based CSP Chips 6pcs/bulb 6pcs/bulb 6pcs/bulb 6pcs/bulb 6pcs/bulb 12pcs/bulb Pack Pack of 2 Pack of 2 Pack of 2 Pack of 2 Pack of 2 Pack of 2 	1	946636
1420951	ocean waves remote control device	ocean wave projector 	1	83002
658389	marvel ultimate alliance 3	Starbar Fly Terminator Pro  Starbar Fly Terminator Pro  Starbar Fly Terminator Pro	1	435168
613861	men big and tall cootonite shirts	Xiloccer Mens Cotton Linen Shirts Men's Long Sleeve V Neck T Shirts Casual T-Shirts for Men Best Fall Winter Tees Gifts 	1	118917
587822	retractable id card printer	Magicard Pronto ID Card Printer & Complete Supplies Package with Bodno Software - Bronze Edition  Input/Output Hopper In: 100 / Out: 70 In: 100 / Out: 70 In: 25 / Out: 25 in:25 / Out:25 In:1 / Out:1 Printer Speed - Black 6 Seconds 5 Seconds 16 Seconds 11 Seconds 7 Seconds Printer Speed - Color 23 Seconds 18 Seconds 45 Seconds 38 Seconds 35 Seconds Card Thickness 20-40 mil 20-40 mil 20-30 mil 20-30 mil 20-40 mil OS Compatibility Windows, Mac Windows, Mac Windows, Mac Windows, Mac Windows, Mac Weight 10 lbs 10 lbs 8 lbs 8 lbs 9 lbs Field Upgrades Dual Sided Dual Sided  	1	637698
123551	work uniform men	Chef Works Men's Hartford Chef Coat  Brimming with confidence, the Hartford stands ready to tackle everyday tasks. From the grandest project to the tiniest minutia, Hartford is your day-in-and-day-out hero. It feels executive, even if the price point doesn’t.  Brimming with confidence, the Hartford stands ready to tackle everyday tasks. From the grandest project to the tiniest minutia, Hartford is your day-in-and-day-out hero. It feels executive, even if the price point doesn’t.From the manufacturer  Product Highlights Cool Vent Award-winning fabric technology that wicks moisture and heat Lite High-quality, comfortable fine-twill fabric Poly/cotton Fabric blend adds comfort and durability  Chef Works Men's Hartford Chef Coat Chef Works Custom Mens Hartford Chef Coat Chef Works Men's Morocco Chef Coat Chef Works Men's Montreal Cool Vent Chef Coat Chef Works Men's Gramercy Denim Chef Coat Fabric Blend 65% Polyester, 35% Cotton Blend 65% Polyester, 35% Cotton Blend 65% Polyester, 35% Cotton Blend 65% Polyester, 35% Cotton Blend 100% Cotton Fabric Weight 4.7 oz. 4.7 oz. 4.7 oz. 4.7 oz. 4.6 oz. Closure Single-breasted, zipper closure Single-breasted, zipper closure Double-breasted, cloth-covered buttons Double-breasted, cloth-covered buttons Single-breasted, zipper closure Pockets Left and right sleeve pockets Left and right sleeve pockets Left chest pocket, left sleeve thermometer pocket Left chest pocket, left sleeve thermometer pocket Left and right sleeve pockets Colors Available in white, black, blue and graphite Available in white, black, blue and graphite Available in seven colors Available in black or white Available in black or indigo blue Chef Works Men's Lightweight Baggy Chef Pants Chef Works Men's Cool Vent Baggy Chef Pants Chef Works Men's Essential Baggy Chef Pants Fabric 65% Polyester, 35% Cotton Blend 65% Polyester, 35% Cotton Blend 65% Polyester, 35% Cotton Blend Pockets 4 4 3 Size XS-3XL XS-3XL 2XS-7XL 	1	851669
89358	olive green purses for women	Laurel Burch (LB5230) Shoulder Tote Zipper Top 19, 1/2-Inch by 6, 3/4-Inch by 15-Inch, Fantasticats  LAUREL BURCH-Shoulder Tote Zipper Top: Fantasticats. The brilliant hues and wonderful patterns of these carefully designed totes appeal to everyone. They are artful and useful at the same time! This package contains one 14-1/2x19 inch zipped bag; one inside pocket with zipper and two twenty- two inch handles. Imported.  LAUREL BURCH-Shoulder Tote Zipper Top: Fantasticats. The brilliant hues and wonderful patterns of these carefully designed totes appeal to everyone. They are artful and useful at the same time! This package contains one 14-1/2x19 inch zipped bag; one inside pocket with zipper and two twenty- two inch handles. Imported.	1	998816
949778	zulay sweetenerorganic	"Zulay Liquid Stevia Drops - Non-Glycemic, No Calories, No Carbs - Liquid Stevia Drops for Coffee, Tea, Desserts - 4 Fl Oz  Sugar-free Sweetener Natural and organic Stevia Rebaudiana plant leaf Highly concentrated Pure consistency Gives off the desired sugar sweetness No carbs or calories Best Tasting Flavor No artificial additives, no after taste & no ""extra flavors"" added Alcohol free, gluten free and non glycemic natural flavor Made of stevia extract powder, purified water, vitamin C, and vegetable glycerine Perfect for fasting, low-carb, and keto dieting Versatile & Portable 120ml capacity dropper bottle Wrapped in plastic seal Easy to carry No leakage or spills Suggested use: Add 4-6 drops to sweetened coffee creamer, tea, yogurt, whipped cream, smoothies, and other recipes. Guilt-Free Lifestyle Enjoy a sugar free, low carb, great-tasting treat that really satisfies Best alternative sweetened substitute for baking Ideal for professional or home use Perfect addition to your carb free keto foods groceries pantry staples, productos keto, & organic spices Does not include cacao powder for baking, vanilla cream, grapefruit, ginger ale, corn, melon, watermelon, butter, pumpkin, toffe crisp or fresh mint leaves peppermint extract.  Sugar-free Sweetener Natural and organic Stevia Rebaudiana plant leaf Highly concentrated Pure consistency Gives off the desired sugar sweetness No carbs or calories Best Tasting Flavor No artificial additives, no after taste & no ""extra flavors"" added Alcohol free, gluten free and non glycemic natural flavor Made of stevia extract powder, purified water, vitamin C, and vegetable glycerine Perfect for fasting, low-carb, and keto dieting Versatile & Portable 120ml capacity dropper bottle Wrapped in plastic seal Easy to carry No leakage or spills Suggested use: Add 4-6 drops to sweetened coffee creamer, tea, yogurt, whipped cream, smoothies, and other recipes. Guilt-Free Lifestyle Enjoy a sugar free, low carb, great-tasting treat that really satisfies Best alternative sweetened substitute for baking Ideal for professional or home use Perfect addition to your carb free keto foods groceries pantry staples, productos keto, & organic spices Does not include cacao powder for baking, vanilla cream, grapefruit, ginger ale, corn, melon, watermelon, butter, pumpkin, toffe crisp or fresh mint leaves peppermint extract."	1	395406
1082925	spring powered scissors for kids	Baker Ross E7376 Kids Safety Scissors - Pack of 3, Soft Grip and Spring Loaded for Kids Arts and Crafts Activties  Our spring loaded design makes it effortless to cut & allows kids to concentrate better on cutting! These craft fabric scissors are comfortable for both right and left hand use. Great for schools, clubs, arts activities and groups, cubs, scouts and child crafting activities etc. Great for kids that are just starting out as it cuts paper and card, and prevents cutting fingers! Baker Ross is a family owned and run business creating innovative arts, craft projects for kids and party favor products. Designed in the United Kingdom - Baker Ross: inspiring creativity.  Our spring loaded design makes it effortless to cut & allows kids to concentrate better on cutting! These craft fabric scissors are comfortable for both right and left hand use. Great for schools, clubs, arts activities and groups, cubs, scouts and child crafting activities etc. Great for kids that are just starting out as it cuts paper and card, and prevents cutting fingers! Baker Ross is a family owned and run business creating innovative arts, craft projects for kids and party favor products. Designed in the United Kingdom - Baker Ross: inspiring creativity.From the manufacturer About Us It’s hard to believe that Baker Ross was founded over 45 years ago. In that time a lot has changed – from the range of products we offer. Reassuringly though, there are quite a few things that haven’t changed a bit. We’re still the same caring, family run business with a passion for helping children’s development with fun, innovative products – most of which are designed by us.  	1	554923
916767	led light without remote	"2835 White High CRI 90 LED Strip Light - Bright Color Quad Row Flexible LED Tape Lights 24V- IP20 -3,530 lm/m for LED Industrial and Photographic Lighting (1m/3.28' Daylight White)  Product specifications LED Strip Type: quad row led strip lights LED Chip: SMD 2835 480LEDs/m Light Color: Daylight White(6212k) Input Voltage(V): 24VDC Working Power: 1.87A 45W /16.4ft Max CRI (Ra>): 90.3 Working Temperature: -4°F (-20°C) ~ 122°F (50°C) Dimension: 3.28ft/roll, Can be cut every 24LEDs 0.2"" (50mm) LED Quantity: 480 LEDs /meter , 146 LEDs/ft Lifespan: 50,000+hours Dimensions: L100cm(34.9 in ) x W2.8cm(1.1 in ) x H0.13cm(0.05 in ) Lamp Luminous Flux(lm): Up to 3,531 Lumen/m Beam Pattern: 120 degree Water Proof: Non-Waterproof Package includes 1 X 3.28Ft led strips 3 X wire terminals 1 x DC male connector 1 X Product specification 1 X Test report  Product specifications LED Strip Type: quad row led strip lights LED Chip: SMD 2835 480LEDs/m Light Color: Daylight White(6212k) Input Voltage(V): 24VDC Working Power: 1.87A 45W /16.4ft Max CRI (Ra>): 90.3 Working Temperature: -4°F (-20°C) ~ 122°F (50°C) Dimension: 3.28ft/roll, Can be cut every 24LEDs 0.2"" (50mm) LED Quantity: 480 LEDs /meter , 146 LEDs/ft Lifespan: 50,000+hours Dimensions: L100cm(34.9 in ) x W2.8cm(1.1 in ) x H0.13cm(0.05 in ) Lamp Luminous Flux(lm): Up to 3,531 Lumen/m Beam Pattern: 120 degree Water Proof: Non-Waterproof Package includes 1 X 3.28Ft led strips 3 X wire terminals 1 x DC male connector 1 X Product specification 1 X Test report"	1	1024615
741053	compressed air regulator and filter	"Heavy Duty Compressed AIR Filter Regulator Combo Piggyback, Metal Bowl, Visible Sight Glass, 5 Micron Element (3/4"" Manual Drain)  Filter-regulator, or “piggybacks,” combine the functions of both a filter & regulator. Piggybacks are compact design and most effective when space is a constraint. Heavy duty type -- High Air flow and drain capacity. Transparent water level indicator for easy checking. Suitable for any 3/4"" high flow air pressure equipment or system.Filter – Filter water / vapor in order to extend the service life of air tool / air system. Regulator --- can make sure the output/working pressure is in a certain level. Compressed air filters, also known as line filters, remove contaminates from the compressed air leaving a screw or piston compressor, which often has a high water content and concentration of oil or other contaminants. Compressed air in-line filters extend the life of your tools and equipment down stream. Excess moisture collects in the quick release 1/4 turn metal bowl with. Manual drain. FOR REPLACEMENT 5 MICRON FILTER ELEMENTS. COPY AND PASTE ASIN TO YOUR AMAZON SEARCH B01N7VEJ2V  Filter-regulator, or “piggybacks,” combine the functions of both a filter & regulator. Piggybacks are compact design and most effective when space is a constraint. Heavy duty type -- High Air flow and drain capacity. Transparent water level indicator for easy checking. Suitable for any 3/4"" high flow air pressure equipment or system.Filter – Filter water / vapor in order to extend the service life of air tool / air system. Regulator --- can make sure the output/working pressure is in a certain level. Compressed air filters, also known as line filters, remove contaminates from the compressed air leaving a screw or piston compressor, which often has a high water content and concentration of oil or other contaminants. Compressed air in-line filters extend the life of your tools and equipment down stream. Excess moisture collects in the quick release 1/4 turn metal bowl with. Manual drain. FOR REPLACEMENT 5 MICRON FILTER ELEMENTS. COPY AND PASTE ASIN TO YOUR AMAZON SEARCH B01N7VEJ2V"	1	991686
